,source,author,title,description,urlToImage,publishedAt,content
37,"{'id': 'cnn', 'name': 'CNN'}","Rosa Flores, Sara Weisfeldt and Catherine E. Shoichet, CNN",We met migrant teens who just crossed the border in Texas. Here's what they told us,The teenagers said they had journeyed to the US from Guatemala -- some fleeing homes destroyed by hurricanes -- in search of relatives and a better life in the US.,https://cdn.cnn.com/cnnnext/dam/assets/210318171046-01-migrant-teens-south-texas-super-tease.jpg,2021-03-19T12:24:56Z,"Hidalgo County, Texas (CNN)In the pitch-black night, the teens' eyes blink in confusion as the bright beam of a constable's flashlight shines in their direction.
They are in Texas, less than a mile … [+5268 chars]"
38,"{'id': 'bbc-news', 'name': 'BBC News'}",,US footballer Megan Rapinoe slams unequal pay,Soccer star Megan Rapinoe says despite all her success she is still paid less than men in the same job.,https://ichef.bbci.co.uk/images/ic/400xn/p09bsjhv.jpg,2021-03-25T10:25:08Z,"Soccer star Megan Rapinoe said despite her success she is still paid less than men.
Speaking at an event at the White House, to mark Equal Pay Day she said: ""I've been devalued, disrespected, dismis… [+25 chars]"
39,"{'id': 'wired', 'name': 'Wired'}",Maryn McKenna,Covid Spilled From Animals to Humans. Now It’s Spilling Back,Bats likely gave it to a mystery animal that then gave it to people. We passed it on to minks. Where does it go from there—and could it come back to us?,"https://media.wired.com/photos/6054c55ffe20326fb03e5f03/191:100/w_1280,c_limit/Science_climatedesk_474930962.jpg",2021-03-22T11:00:00Z,"By then, five more European Union nations, plus Canada, had also recorded cases on mink farmsbut they were no longer the only places affected. In August, the coronavirus was identified in minks on fu… [+3622 chars]"
40,"{'id': None, 'name': 'Gizmodo.com'}",Whitney Kimball,Republicans' Rich White Friends Will Outlive Us All,"Barring a series of increasingly tragic disasters, we’ll probably be hearing about pandemic-related political favors and mind-melting incompetence for years. Early signs also indicate that we’re in for an exhibition of bipartisan jockeying for the role of pan…","https://i.kinja-img.com/gawker-media/image/upload/c_fill,f_auto,fl_progressive,g_center,h_675,pg_1,q_80,w_1200/cayy7lxjnsdf8wl1ls5c.jpg",2021-03-09T19:40:00Z,"Barring a series of increasingly tragic disasters, well probably be hearing about pandemic-related political favors and mind-melting incompetence for years. Early signs also indicate that were in for… [+6313 chars]"
41,"{'id': None, 'name': 'New York Times'}",Sopan Deb,The Knicks Are Like Blink-182. Let Us Explain.,"Hot in the 1990s and early ’00s. A source of joy and pain for a wildly devoted fan base. An unexpected resurgence. Yep, the parallels are there.",https://static01.nyt.com/images/2021/03/05/sports/05nba-knicks-top-art/05nba-knicks-top-art-facebookJumbo.jpg,2021-03-05T22:49:39Z,"The Knicks are Blink-182.
They are 19-18, a half-game behind the fourth seed in the Eastern Conference. And fans are optimistic. Yelling outside Madison Square Garden optimistic. Spending a bunch of… [+1423 chars]"
42,"{'id': 'the-verge', 'name': 'The Verge'}",Mary Beth Griggs,COVID-19 vaccine supplies are on the rise in the US,The Biden administration says it will have enough COVID-19 vaccines to vaccinate all adults in the US by the end of May. The number of Americans willing to take the vaccine is also increasing.,https://cdn.vox-cdn.com/thumbor/VTMYt2WtkQuxMbMZ1XiBR_OEDjI=/0x306:6048x3472/fit-in/1200x630/cdn.vox-cdn.com/uploads/chorus_asset/file/22349063/1231514913.jpg,2021-03-06T16:00:00Z,"And so is a willingness to get vaccinated
Photo by Jon Cherry / Getty Images
The US government is feeling optimistic about vaccines. By the end of May, it should have enough to vaccinate every adul… [+5580 chars]"
43,"{'id': 'bbc-news', 'name': 'BBC News'}",https://www.facebook.com/bbcnews,US grants Venezuelan migrants temporary protected status,Hundreds of thousands of Venezuelans already in the US now have the chance to stay.,https://ichef.bbci.co.uk/news/1024/branded_news/1E96/production/_117503870_gettyimages-1043143506.jpg,2021-03-09T12:20:01Z,"image copyrightGetty Images
image captionVenezuelans living in the US have been pressing the US government to do more to help
The US government is granting Venezuelans who are living in the US temp… [+2306 chars]"
44,"{'id': None, 'name': 'Lifehacker.com'}",Elizabeth Yuko,How to Keep Fire Ants Away From You and Your Home,"We did it: we made it through the long COVID winter. And now that COVID spring is here, we’re starting to see some changes. It’s getting a little warmer outside, spring flowers are starting to bloom, and fire ant season is upon us. Along with the fall, spring…","https://i.kinja-img.com/gawker-media/image/upload/c_fill,f_auto,fl_progressive,g_center,h_675,pg_1,q_80,w_1200/j0xyxh7t0rsjmt0mzanz.jpg",2021-03-20T13:00:00Z,"We did it: we made it through the long COVID winter. And now that COVID spring is here, were starting to see some changes. Its getting a little warmer outside, spring flowers are starting to bloom, a… [+5192 chars]"
45,"{'id': None, 'name': 'Lifehacker.com'}","Beth Skwarecki on Vitals, shared by Beth Skwarecki to Lifehacker",Vaccine Death Reports Are Not What They Seem,"The US government maintains a database called VAERS, to which anybody can file a report if they think something bad happened to them after receiving a vaccine. It’s an important tool in keeping tabs on vaccine safety, but it’s also being mined by anti-vaccine…","https://i.kinja-img.com/gawker-media/image/upload/c_fill,f_auto,fl_progressive,g_center,h_675,pg_1,q_80,w_1200/ue8mlvwu8o1fpwugefyo.jpg",2021-03-19T19:30:00Z,"The US government maintains a database called VAERS, to which anybody can file a report if they think something bad happened to them after receiving a vaccine. Its an important tool in keeping tabs o… [+3938 chars]"
46,"{'id': None, 'name': 'Lifehacker.com'}",Sam Blum,"Cinnamon Toast Shrimp Isn't Real, Probably, and Neither Are These Urban Food Legends","One of the hottest trending topics on Twitter this week comes to us from a guy who claims he found shrimp tails in his box of Cinnamon Toast Crunch. Jensen Karp, a writer, podcast host, and comedian, is the man behind the now-infamous debacle, which has garne…","https://i.kinja-img.com/gawker-media/image/upload/c_fill,f_auto,fl_progressive,g_center,h_675,pg_1,q_80,w_1200/irpo2myk7oznzwyimm8i.png",2021-03-24T20:45:00Z,"One of the hottest trending topics on Twitter this week comes to us from a guy who claims he found shrimp tails in his box of Cinnamon Toast Crunch. Jensen Karp, a writer, podcast host, and comedian,… [+4529 chars]"
47,"{'id': None, 'name': 'New York Times'}",,‘I Thought I Was Going to Die’: A Capitol Police Officer Recounts Jan. 6,Officer Harry Dunn tells us what the Capitol riot was like from the inside.,https://static01.nyt.com/images/2021/03/10/podcasts/10DAILY-dunn/merlin_184241481_a76adda9-8e62-4066-8a6a-dbfed4d17191-facebookJumbo.jpg,2021-03-10T11:00:05Z,"The Daily is made by Theo Balcomb, Lisa Tobin, Rachel Quester, Lynsea Garrison, Annie Brown, Clare Toeniskoetter, Paige Cowett, Michael Simon Johnson, Brad Fisher, Larissa Anderson, Wendy Dorr, Chris… [+663 chars]"
48,"{'id': 'the-verge', 'name': 'The Verge'}",Kaitlin Hatton,The art of upcycling old sneakers into high-fashion corsets,"FRISKMEGOOD is a sustainable fashion brand that uses upcycled sneakers and other secondhand materials to make corsets, bodysuits, and other clothing pieces. Designer Cierra Boyd tells us about her inspiration and her future plans for her brand.",https://cdn.vox-cdn.com/thumbor/BJg2KLh5lejmg8ZvXhFnYRaCDsA=/0x0:2160x1131/fit-in/1200x630/cdn.vox-cdn.com/uploads/chorus_asset/file/22359732/friskmegoodcomp.jpg,2021-03-11T15:00:00Z,"Designer Cierra Boyd’s FRISKMEGOOD clothing line reworks upcycled sneakers into futuristic fashion. | Photos: FRISKMEGOOD

 

 Modern fashion is fraught with wasted product, so some designers are th… [+8985 chars]"
49,"{'id': 'the-verge', 'name': 'The Verge'}",Taylor Lyles,It’s your last chance to get Disney Plus at its current subscription price,"Starting on March 26th, Disney Plus subscribers in the US will see a $1 price increase to their subscriptions — increasing from $6.99 per month or $69.99 annually to $7.99 a month or $79.99 annually.",https://cdn.vox-cdn.com/thumbor/UNwCDDyNGwQAeUhyZpyrem-mAUU=/0x38:1920x1043/fit-in/1200x630/cdn.vox-cdn.com/uploads/chorus_asset/file/13412121/disneyplus.0.jpg,2021-03-24T14:32:13Z,"The price is going up to $7.99 a month for subscribers in the US starting on March 26th
If you buy something from a Verge link, Vox Media may earn a commission. See our ethics statement.
Image: Dis… [+1147 chars]"
50,"{'id': None, 'name': 'Lifehacker.com'}",Melanie Pinola and A.A. Newton,Top 10 Home Improvement Tips Every Homeowner Should Know,"Homeownership has a way of awakening the inner Bob Vila in all of us—even the ones who know nothing about home improvement. Whether you’re tackling huge renovations or tiptoeing your way into the world of DIY, these tips will help you set yourself up for succ…","https://i.kinja-img.com/gawker-media/image/upload/c_fill,f_auto,fl_progressive,g_center,h_675,pg_1,q_80,w_1200/ucgoze5fhrqqo4rgpkug.jpg",2021-03-15T11:10:00Z,Homeownership has a way of awakening the inner Bob Vila in all of useven the ones who know nothing about home improvement. Whether youre tackling huge renovations or tiptoeing your way into the world… [+5838 chars]
51,"{'id': 'techcrunch', 'name': 'TechCrunch'}",Annie Siebert,US-listed SPACs have a new target: Latin American tech companies,"There has been an unprecedented IPO boom of tech companies in the Brazilian stock exchange, which is transformative for a market that was traditionally dominated by utilities, mining, oil and financial companies.",https://techcrunch.com/wp-content/uploads/2021/03/GettyImages-1029534500.jpg?w=711,2021-03-12T18:32:29Z,"More posts by this contributor
There has been anunprecedented IPO boom of tech companies in the Brazilian stock exchange, which is transformative for a market that was traditionally dominated by uti… [+1346 chars]"
52,"{'id': 'techcrunch', 'name': 'TechCrunch'}",Natasha Lomas,"US privacy, consumer, competition and civil rights groups urge ban on ‘surveillance advertising’","Ahead of another big tech vs Congress ‘grab your popcorn’ grilling session, scheduled for March 25 — when US lawmakers will once again question the CEOs of Facebook, Google and Twitter on the unlovely topic of misinformation — a coalition of organizations acr…",https://techcrunch.com/wp-content/uploads/2020/08/stalkerware-eyes.jpg?w=600,2021-03-22T16:00:31Z,"“Big Tech platforms amplify hate, illegal activities, and conspiracism — and feed users increasingly extreme content — because thats what generates the most engagement and profit,” they warn.
“Their… [+9050 chars]"
53,"{'id': 'techcrunch', 'name': 'TechCrunch'}",Kirsten Korosec,Arrival to open a second US microfactory to build electric vans for UPS,"Arrival, the UK electric vehicle startup that will soon be a publicly traded company, plans to build a second microfactory in the United States. The announcement comes several months after Arrival picked Charlotte, North Carolina for its North American headqu…",https://techcrunch.com/wp-content/uploads/2020/11/Arrival-Bus-Gamma_0-Van-7-2.jpg?w=600,2021-03-17T15:53:05Z,"Arrival, the UK electric vehicle startup that will soon be a publicly traded company, plans to build a second microfactory in the United States.
The announcement comes several months after Arrival p… [+1771 chars]"
54,"{'id': 'techcrunch', 'name': 'TechCrunch'}",Annie Siebert,"To rebuild manufacturing, the US needs to beef up the Small Business Innovation Research program","We have only a small window of time to restore manufacturing as a foundation of American prosperity, and a remarkable but underappreciated federal program has a big role to play.",https://techcrunch.com/wp-content/uploads/2021/03/GettyImages-1223169458.jpg?w=764,2021-03-24T18:32:19Z,"More posts by this contributor
I grew up in poverty in upstate New York, but I was lucky enough to study engineering at Rensselaer Polytechnic Institute. I founded a company that went public when I … [+4206 chars]"
55,"{'id': None, 'name': 'Lifehacker.com'}",Elizabeth Yuko,"Win $1,000 for Having the Most Creative Face Mask Design","The past year has taken us on quite the face mask journey, going from shortages, to DIY creations, to having options from basically every clothing company. And while some people opt for something in a basic black, or a traditional blue surgical mask, others h…","https://i.kinja-img.com/gawker-media/image/upload/c_fill,f_auto,fl_progressive,g_center,h_675,pg_1,q_80,w_1200/qnau3drsdifp3ukqeysx.jpg",2021-02-27T14:00:00Z,"The past year has taken us on quite the face mask journey, going from shortages, to DIY creations, to having options from basically every clothing company. And while some people opt for something in … [+1334 chars]"
56,"{'id': None, 'name': 'Lifehacker.com'}",Beth Skwarecki,No One Food Item Is 'Bad' For You,"We are, as a society, obsessed with questions about whether an individual food is “good” or “bad” for us. But with the exception of things like poisonous mushrooms (which I would not classify as “food”), no food is bad for you. Read more...","https://i.kinja-img.com/gawker-media/image/upload/c_fill,f_auto,fl_progressive,g_center,h_675,pg_1,q_80,w_1200/xzintkmszvuxhal11uje.jpg",2021-03-02T20:30:00Z,"We are, as a society, obsessed with questions about whether an individual food is good or bad for us. But with the exception of things like poisonous mushrooms (which I would not classify as food), n… [+3574 chars]"
57,"{'id': 'the-verge', 'name': 'The Verge'}",Nicole Wetsman,New COVID-19 reporting tool is another patch for the US’s rickety health data system,A data reporting tool built by the CDC and the US Digital Service unit helps long-term care facilities report rapid COVID-19 test results. These facilities aren’t connected to the public health system.,https://cdn.vox-cdn.com/thumbor/wK9jhzQsDKlrdC3t1887tDdaDLI=/0x329:2400x1586/fit-in/1200x630/cdn.vox-cdn.com/uploads/chorus_asset/file/22342666/1283618423.jpg,2021-03-03T18:29:15Z,"Antigen tests run at a university in Wisconsin | Photo by David Joles/Star Tribune via Getty Images

 


 But the CDC system doesn’t fix the foundational issue It was taking staff all day to wrangle… [+13110 chars]"
58,"{'id': 'the-verge', 'name': 'The Verge'}",Jon Porter,Amazon’s cashierless tech expands to London with first international store,Amazon has opened its first cashier-less store outside of the US with a new Amazon Fresh location in London. The store uses the company’s Just Walk Out technology. Billing is handled automatically.,https://cdn.vox-cdn.com/thumbor/EOdmLeOayp94TCePlgFZsPEOCkY=/0x643:6648x4124/fit-in/1200x630/cdn.vox-cdn.com/uploads/chorus_asset/file/22344611/Amazon_Fresh_JWO_Signage.jpeg,2021-03-04T09:40:21Z,"The Amazon Fresh store will offer groceries and pre-prepared meals
Customers scan the Amazon app at the stores entrance.
Image: Amazon
Amazon has opened its first cashierless store outside of the … [+2043 chars]"
59,"{'id': 'the-verge', 'name': 'The Verge'}",Adi Robertson,YouTube will lift Trump’s suspension when ‘the risk of violence has decreased’,"YouTube CEO Susan Wojcicki says former President Donald Trump’s suspension on YouTube, implemented after the January 6th attack on the US Capitol, will be lifted when the risk of him inciting violence has lowered.",https://cdn.vox-cdn.com/thumbor/kb74xvBIK-DhOuKatn7dWQunBoc=/0x146:2040x1214/fit-in/1200x630/cdn.vox-cdn.com/uploads/chorus_asset/file/10581019/acastro_180403_1777_youtube_0002.jpg,2021-03-04T21:02:58Z,"Hes still permanently banned from Facebook and Twitter
Illustration by Alex Castro / The Verge
YouTube CEO Susan Wojcicki says the site will lift former President Donald Trumps suspension when the … [+1994 chars]"
60,"{'id': None, 'name': 'New York Times'}",Roberta Smith,Garrett Bradley Reminds Us That Black Joy Always Existed,"Her elaborate video installation, which restages quiet and remarkable moments in early 20th-century Black life, is at the Museum of Modern Art.",https://static01.nyt.com/images/2021/03/12/arts/11garrett-bradley-1/11garrett-bradley-1-facebookJumbo.jpg,2021-03-11T20:56:57Z,"The journey of a white sheet through several scenes exemplifies the fluidity of Bradleys camera, storytelling and mutating meanings. It begins with a white sheet worn by a white man sitting under a t… [+1257 chars]"
61,"{'id': None, 'name': 'Gizmodo.com'}","Dharna Noor on Earther, shared by Brian Kahn to Gizmodo","No, Mark Zuckerberg, Virtual Reality Goggles Won't Solve the Climate Crisis","The billionaires are once again claiming that tech will save us. In an interview published Monday, Facebook CEO Mark Zuckerberg said that by the end of this decade, he expects we’ll all have access to virtual reality goggles that will allow us to feel like we…","https://i.kinja-img.com/gawker-media/image/upload/c_fill,f_auto,fl_progressive,g_center,h_675,pg_1,q_80,w_1200/qixvkp6i9fxbexbrsx6r.jpg",2021-03-09T22:03:00Z,"The billionaires are once again claiming that tech will save us. In an interview published Monday, Facebook CEO Mark Zuckerberg said that by the end of this decade, he expects well all have access to… [+4285 chars]"
62,"{'id': 'bbc-news', 'name': 'BBC News'}",https://www.facebook.com/bbcnews,Covid vaccine: AstraZeneca amends US vaccine efficacy results,The vaccine-maker slightly downgrades its efficacy rate as it awaits US regulatory approval.,https://ichef.bbci.co.uk/news/1024/branded_news/13B1A/production/_115866608_gettyimages-1229951797.jpg,2021-03-25T09:38:53Z,"AstraZeneca has downgraded the efficacy result of its coronavirus vaccine trial in the US after health officials questioned the results.
The Anglo-Swedish firm adjusted the efficacy rate of its vacc… [+3396 chars]"
63,"{'id': 'bbc-news', 'name': 'BBC News'}",,Debris from SpaceX rocket lights up US skies,The lights streaking across US skies on Thursday stunned onlookers. But this wasn't a meteor shower.,https://ichef.bbci.co.uk/images/ic/400xn/p09byfqv.jpg,2021-03-26T16:48:45Z,"'I'm tripping right now. What is going on?' Video, 00:00:55'I'm tripping right now. What is going on?'"
64,"{'id': 'bbc-news', 'name': 'BBC News'}",https://www.facebook.com/bbcnews,US to send 4m vaccine doses to Canada and Mexico,The Biden plan to give AstraZeneca jabs to neighbours is seen as part of 'vaccine diplomacy'.,https://ichef.bbci.co.uk/news/1024/branded_news/1260C/production/_116867257_hi065587233.jpg,2021-03-18T21:43:29Z,"The US will release four million doses of the AstraZeneca coronavirus vaccine to its neighbours, Canada and Mexico, the White House has said.
The plan would mark the first time the US has directly s… [+1828 chars]"
65,"{'id': 'bbc-news', 'name': 'BBC News'}",https://www.facebook.com/bbcnews,The Talk: Sharon Osbourne leaves US show after racism row,"CBS says her behaviour in an on-air row over the Duchess of Sussex ""did not align with our values"".",https://ichef.bbci.co.uk/news/1024/branded_news/7208/production/_117729192_gettyimages-1176413230-594x594.jpg,2021-03-27T07:42:53Z,"image copyrightGetty Images
image captionSheryl Underwood and Sharon Osbourne at a 2016 awards ceremony
TV personality Sharon Osbourne has left US chat show The Talk after a heated on-air debate ab… [+3143 chars]"
66,"{'id': None, 'name': 'New York Times'}",James Poniewozik,TV’s Battle of the Binge: Why the Wait Can Be Worth It,"Streaming TV promised to free us from schedules, but series like “WandaVision” show that weekly rituals still have power.",https://static01.nyt.com/images/2021/03/22/arts/19binge/19binge-facebookJumbo.jpg,2021-03-19T16:13:06Z,"For an era well, a few years this defined streaming TV. And the different formats led to different creative forms. Traditional TV serials broke stories into structured units with tune-in-next-time en… [+1979 chars]"
67,"{'id': 'cnn', 'name': 'CNN'}","Caroline Kelly, CNN",UN Ambassador Linda Thomas-Greenfield: Congress' work in wake of Capitol riot 'shows that our democracy is resilient',US ambassador to the United Nations Linda Thomas-Greenfield said Monday that Congress' work in the immediate wake of the US Capitol insurrection confirmed to her that American democracy had survived the January 6 attack.,https://cdn.cnn.com/cnnnext/dam/assets/210301222811-02-lemon-greenfield-interview-screengrab-super-tease.jpg,2021-03-02T03:53:54Z,(CNN)US ambassador to the United Nations Linda Thomas-Greenfield said Monday that Congress' work in the immediate wake of the US Capitol insurrection confirmed to her that American democracy had surv… [+3087 chars]
68,"{'id': 'cnn', 'name': 'CNN'}","Jen Christensen, CNN",Johnson & Johnson's Covid-19 vaccine gets emergency use authorization from FDA,"The US Food and Drug Administration authorized Johnson & Johnson's Covid-19 vaccine Saturday. It is the first single dose Covid-19 vaccine available in the US, and is one that ""checks nearly all the boxes.""",https://cdn.cnn.com/cnnnext/dam/assets/210219103254-01-johnson-and-johnson-covid-19-vaccine-south-africa-0218-super-tease.jpg,2021-02-27T23:16:42Z,"(CNN)The US Food and Drug Administration authorized Johnson &amp; Johnson's Covid-19 vaccine Saturday. It is the first single dose Covid-19 vaccine available in the US, and is one that ""checks nearly… [+5852 chars]"
69,"{'id': 'bbc-news', 'name': 'BBC News'}",https://www.facebook.com/bbcnews,Amanda Gorman: US poet says security guard labelled her 'suspicious',The US poet says she was offered no apology after being confronted while returning home.,https://ichef.bbci.co.uk/news/1024/branded_news/680D/production/_117473662_gettyimages-1230697200.jpg,2021-03-06T09:04:50Z,"image captionGorman was the youngest poet to ever perform at a presidential inauguration
Amanda Gorman, the young poet who found global fame after performing at President Joe Biden's inauguration, h… [+3169 chars]"
70,"{'id': 'bbc-news', 'name': 'BBC News'}",https://www.facebook.com/bbcnews,US Capitol riots: Suspect held after deportation from Kenya,"Isaac Sturgeon, of Montana, is charged with seven counts including shoving a barricade into officers.",https://ichef.bbci.co.uk/news/1024/branded_news/D5B6/production/_117501745_2d5eeadc-7492-4121-9de4-c846bc995b61.jpg,2021-03-09T11:28:04Z,"image captionThe riots saw five people including a police officer killed, and shook the foundations of US democracy
An American linked to January's deadly riots at the US Capitol in Washington DC ha… [+2277 chars]"
71,"{'id': None, 'name': 'Gizmodo.com'}",Catie Keck,"PS4, Nvidia Shield, and Fire TV Are Getting More Free Streaming Apps","For those of us looking for more streaming options on a tight budget, you can’t beat free, right?Read more...","https://i.kinja-img.com/gawker-media/image/upload/c_fill,f_auto,fl_progressive,g_center,h_675,pg_1,q_80,w_1200/l4wbyb7n0q7d58vdoiuy.jpg",2021-03-09T19:00:00Z,"For those of us looking for more streaming options on a tight budget, you cant beat free, right?
IMDb TV, the free, ad-supported streaming service owned by Amazon, is now available on PlayStation 4,… [+1484 chars]"
72,"{'id': None, 'name': 'New York Times'}",,Coming of Age: Teens on Coping With a Pandemic Year,Teens across the United States show us how they have met life's challenges in the midst of a pandemic.,https://static01.nyt.com/images/2021/03/14/multimedia/14sp-comingofage-Bagaporo-still/14sp-comingofage-Bagaporo-facebookJumbo.jpg,2021-03-08T13:15:01Z,"March 7, 2021What has it been like to be a teenager during the first year of a historic pandemic?
The New York Times, through its Learning Network, asked the question, and more than 5,500 responses … [+1445 chars]"
73,"{'id': 'cnn', 'name': 'CNN'}","Laura Ungar, Kaiser Health News",Surge in child hunger overwhelms richest US counties,Financial fallout from Covid-19 has pushed child hunger to record levels. Wealthy counties with steep jumps aren't always as ready to cope as places that have long dealt with poverty and were already equipped with robust charitable food networks.,https://cdn.cnn.com/cnnnext/dam/assets/210318142258-02-wealthy-counties-child-hunger-khn-partner-wellness-super-tease.jpg,2021-03-23T08:21:48Z,"(KHN)Alexandra Sierra carried boxes of food to her kitchen counter, where her 7-year-old daughter, Rachell, stirred a pitcher of lemonade.
""Oh, my God, it smells so good!"" Sierra, 39, said of the bo… [+9316 chars]"
74,"{'id': 'techcrunch', 'name': 'TechCrunch'}",Walter Thompson,4 ways startups will drive GPT-3 adoption in 2021,"What OpenAI — and crucially, the beta testers with access to GPT-3 and other models — are able to accomplish continues to surprise and in many cases, unexpectedly delight us.",https://techcrunch.com/wp-content/uploads/2021/03/GettyImages-875579516.jpg?w=600,2021-03-09T19:32:26Z,"The introduction of GPT-3 in 2020 was a tipping point for artificial intelligence. In 2021, this technology will power the launch of a thousand new startups and applications. GPT-3 and similar models… [+2482 chars]"
