,source,author,title,description,urlToImage,publishedAt,content
37,"{'id': None, 'name': 'New York Times'}",Catie Edmondson,Asian-American Lawmakers Call Out Racist Language: ‘I Am Not a Virus’,"House lawmakers described the fear and trauma rippling through the Asian-American community, and they argued that an uptick in violence was a result of the rise of anti-China messaging stoked during the pandemic.",https://static01.nyt.com/images/2021/03/18/us/politics/18dc-judiciary/18dc-judiciary-facebookJumbo.jpg,2021-03-18T22:30:01Z,"You can say racist, stupid stuff if you want, but Im asking you to please stop using racist terms like Kung flu or Wuhan virus or other ethnic identifiers in describing this virus, Representative Ted… [+1508 chars]"
38,"{'id': None, 'name': 'New York Times'}",Julian E. Barnes,The Intelligence on Russia Was Clear. It Was Not Always Presented That Way.,"A newly declassified intelligence report made clear that government agencies long knew of Russia’s work to aid Donald Trump, but he and allies muddied the waters.",https://static01.nyt.com/images/2021/03/17/us/politics/17dc-intel1/17dc-intel1-facebookJumbo.jpg,2021-03-17T23:06:48Z,"Senior Trump administration officials comments about China were also at odds with the report.
John Ratcliffe, Mr. Trumps final director of national intelligence, said publicly before and after the e… [+1920 chars]"
39,"{'id': None, 'name': 'New York Times'}",Elsie Chen and Sui-Lee Wee,"China Tried to Slow Divorces by Making Couples Wait. Instead, They Rushed.","A new rule requiring a cooling-off period before a divorce could be granted led to an outcry, as well as a surge of applications to beat the deadline.",https://static01.nyt.com/images/2021/02/28/world/28china-divorce-1sub/28china-divorce-1sub-facebookJumbo.jpg,2021-02-27T04:06:49Z,"That same evening, Ms. Shi got an appointment and her divorce came through the next morning. Im very grateful, she said. In her view, she said, it is marriage that needs a cooling-off period, not div… [+1604 chars]"
40,"{'id': 'reuters', 'name': 'Reuters'}",Reuters Staff,China vows crackdown on sand mining on Yangtze - Reuters,"China has launched a crackdown on illegal sand mining operations on the Yangtze river, which have made large parts of central China more vulnerable to drought.",https://static.reuters.com/resources/r/?m=02&d=20210316&t=2&i=1555005881&r=LYNXMPEH2F005&w=800,2021-03-16T00:17:00Z,"By Reuters Staff
FILE PHOTO: A boat lies ashore near Jiujiang Yangtze River Bridge that crosses from Hubei province into Jiujiang, Jiangxi province, China, January 31, 2020. REUTERS/Thomas Peter
SH… [+1711 chars]"
41,"{'id': 'reuters', 'name': 'Reuters'}",Reuters Staff,China IMCAS's COVID-19 vaccine obtained emergency use approval in China - Reuters,"A COVID-19 vaccine developed by the Institute of Microbiology of Chinese Academy of Sciences (IMCAS) has obtained the greenlight for emergency use in China, the institute said on Monday, marking the country's fifth vaccine eligible for some scale of use.",https://s1.reutersmedia.net/resources_v2/images/rcom-default.png?w=800,2021-03-15T13:59:00Z,"By Reuters Staff
BEIJING, March 15 (Reuters) - A COVID-19 vaccine developed by the Institute of Microbiology of Chinese Academy of Sciences (IMCAS) has obtained the greenlight for emergency use in C… [+1267 chars]"
42,"{'id': 'reuters', 'name': 'Reuters'}",Reuters Staff,"China says China-U.S. talks were candid, constructive and beneficial - Reuters","China's top diplomat, Yang Jiechi, said two days of talks with the United States in Alaska that ended on Friday were candid, constructive and beneficial, while adding: ""But of course, there are still differences,"" China's CGTN television network reported.",https://static.reuters.com/resources/r/?m=02&d=20210319&t=2&i=1555534153&r=LYNXMPEH2I1EG&w=800,2021-03-19T21:14:00Z,"By Reuters Staff
FILE PHOTO: Yang Jiechi, director of the Central Foreign Affairs Commission Office for China, addresses the U.S. delegation at the opening session of U.S.-China talks at the Captain… [+773 chars]"
43,"{'id': 'reuters', 'name': 'Reuters'}",Reuters Staff,China embassy takes swipe at 'fusty' Japan over South China Sea - Reuters,"China's embassy in the Philippines has blamed ""some external countries"" for stoking tensions in the region, in remarks aimed at Japan after its ambassador stressed the need for peace and stability and in the South China Sea.",https://static.reuters.com/resources/r/?m=02&d=20210324&t=2&i=1556026908&r=LYNXMPEH2N10V&w=800,2021-03-24T11:32:00Z,"By Reuters Staff
MANILA (Reuters) - Chinas embassy in the Philippines has blamed some external countries for stoking tensions in the region, in remarks aimed at Japan after its ambassador stressed t… [+1927 chars]"
44,"{'id': None, 'name': 'New York Times'}",Lara Jakes,"In First Talks, Dueling Accusations Set Testy Tone for U.S.-China Diplomacy","U.S. officials said the two days of discussions would continue, but accused the Chinese delegation of violating the format for meetings that had sought to find common ground between the superpowers.",https://static01.nyt.com/images/2021/03/18/us/politics/18dc-diplo-china/18dc-diplo-china-facebookJumbo.jpg,2021-03-19T01:37:34Z,"As journalists were again asked to leave after the American response, Mr. Yang turned directly to the TV cameras and said, in English, Wait. He then launched into another long critique of U.S. policy… [+1751 chars]"
45,"{'id': 'reuters', 'name': 'Reuters'}",Laurie Goering,Analysis: China expected to favour green tech over coal in new five-year plan - Reuters,"China, which long targeted rapid industrial growth despite its environmental consequences, now aims to become the global leader in ""low-carbon tech for a carbon-constrained world"" as it unveils its new five-year plan this week, China analysts said.",https://s1.reutersmedia.net/resources_v2/images/rcom-default.png?w=800,2021-03-01T20:22:00Z,"LONDON (Thomson Reuters Foundation) - China, which long targeted rapid industrial growth despite its environmental consequences, now aims to become the global leader in low-carbon tech for a carbon-c… [+4213 chars]"
46,"{'id': 'reuters', 'name': 'Reuters'}",Reuters Staff,China summons British ambassador over 'inappropriate' article - Reuters,"China summoned Britain's ambassador in Beijing on Tuesday to lodge ""stern representations"" over an ""inappropriate"" article she wrote defending recent international media coverage on China, the foreign ministry said.",https://s1.reutersmedia.net/resources_v2/images/rcom-default.png?w=800,2021-03-09T16:43:00Z,"By Reuters Staff
BEIJING (Reuters) - China summoned Britains ambassador in Beijing on Tuesday to lodge stern representations over an inappropriate article she wrote defending recent international me… [+2537 chars]"
47,"{'id': 'reuters', 'name': 'Reuters'}",Reuters Staff,Foreign journalists in China see 'rapid decline in media freedom': survey - Reuters,"China used coronavirus prevention measures, intimidation and visa curbs to limit foreign reporting in 2020, ushering in a ""rapid decline in media freedom,"" the Foreign Correspondents' Club of China (FCCC) said on Monday.",https://s1.reutersmedia.net/resources_v2/images/rcom-default.png?w=800,2021-03-01T05:06:00Z,"By Reuters Staff
BEIJING (Reuters) - China used coronavirus prevention measures, intimidation and visa curbs to limit foreign reporting in 2020, ushering in a rapid decline in media freedom, the For… [+1895 chars]"
48,"{'id': 'reuters', 'name': 'Reuters'}",Reuters Staff,China Eastern signs firm order with COMAC to buy 5 C919 jets - Reuters,"China Eastern Airlines , the launch customer for China's home-built C919 jets, signed a firm order with the state planemaker on Monday to buy five of the narrowbody aircraft, the Commercial Aircraft Corporation of China (COMAC) said.",https://s1.reutersmedia.net/resources_v2/images/rcom-default.png?w=800,2021-03-01T10:44:00Z,"By Reuters Staff
BEIJING, March 1 (Reuters) - China Eastern Airlines , the launch customer for Chinas home-built C919 jets, signed a firm order with the state planemaker on Monday to buy five of the… [+775 chars]"
49,"{'id': 'bbc-news', 'name': 'BBC News'}",,Tokyo 2020: China offers Covid vaccine doses for Olympic and Paralympic athletes,The Chinese Olympic Committee offers Covid vaccine doses for athletes competing at this summer's Tokyo Games and at Beijing 2022.,https://ichef.bbci.co.uk/live-experience/cps/624/cpsprodpb/135B2/production/_117528297_tokyo.jpg,2021-03-11T12:48:28Z,"The Tokyo Olympics was due to start on 24 July 2020 but was postponed for a year because of the coronavirus pandemic
The Chinese Olympic Committee has offered Covid vaccine doses for those competing… [+1088 chars]"
50,"{'id': 'bbc-news', 'name': 'BBC News'}",https://www.facebook.com/bbcnews,"China sending children of exiled Uighur parents to orphanages, says Amnesty","Young Uighur children are taken into orphanages without parents' consent, Amnesty International says.",https://ichef.bbci.co.uk/news/1024/branded_news/12EAD/production/_113158477_mediaitem113158476.jpg,2021-03-19T08:55:48Z,"image captionA file photo shows a Uighur woman with children in China's northwest Xinjiang region
China has forcibly separated Uighur families by taking young children into state orphanages, accordi… [+3630 chars]"
51,"{'id': 'reuters', 'name': 'Reuters'}",Reuters Staff,China shares rebound; slower factory expansion caps gains - Reuters,China shares rebound; slower factory expansion caps gains  Reuters,https://s1.reutersmedia.net/resources_v2/images/rcom-default.png?w=800,2021-03-01T04:39:00Z,"By Reuters Staff
* China factory activity expanded more slowly in February
* Market volatility could intensify in short term -UBS analysts
SHANGHAI, March 1 (Reuters) - Chinese shares rose on Mond… [+1775 chars]"
52,"{'id': 'reuters', 'name': 'Reuters'}",Reuters Staff,Breakingviews - Capital Calls: China falls back on GDP targets - Reuters,Breakingviews - Capital Calls: China falls back on GDP targets  Reuters,https://static.reuters.com/resources/r/?m=02&d=20210305&t=2&i=1553817112&r=LYNXNPEH2406D&w=800,2021-03-05T03:58:00Z,"By Reuters Staff
Chinese President Xi Jinping reads a document at the opening session of the National People's Congress (NPC) at the Great Hall of the People in Beijing, China March 5, 2021. REUTERS… [+1804 chars]"
53,"{'id': 'reuters', 'name': 'Reuters'}",Reuters Staff,Breakingviews - Capital Calls: China digs bitcoin hole - Reuters,Breakingviews - Capital Calls: China digs bitcoin hole  Reuters,https://static.reuters.com/resources/r/?m=02&d=20210302&t=2&i=1553439612&r=LYNXNPEH210LQ&w=800,2021-03-02T10:51:00Z,"By Reuters Staff
Cryptocurrency mining facilities are seen in Pristina, Kosovo June 12, 2018.
HONG KONG (Reuters Breakingviews) - Concise insights on global finance in the Covid-19 era.
SUPPLY-SID… [+1621 chars]"
54,"{'id': 'techcrunch', 'name': 'TechCrunch'}",Rita Liao,What China’s Big Tech CEOs propose at the annual parliament meeting,The annual meetings of the Chinese parliament and its advisory body are underway in Beijing this week. Top executives from some of China’s largest tech firms are among the thousands of delegates who attend and put forward their opinions. Here is a look at wha…,https://techcrunch.com/wp-content/uploads/2021/03/GettyImages-1305264243.jpg?w=600,2021-03-05T07:31:14Z,The annual meetings of the Chinese parliament and its advisory body are underway in Beijing this week. Top executives from some of China’s largest tech firms are among the thousands of delegates who … [+2710 chars]
55,"{'id': 'reuters', 'name': 'Reuters'}",Reuters Staff,Philippines protests 'threatening presence' of Chinese vessels in disputed waters - Reuters,"The Philippines complained to China on Monday about what it described as the ""swarming and threatening presence"" of Chinese vessels in disputed waters in the South China Sea and demanded they be withdrawn from the area.",https://static.reuters.com/resources/r/?m=02&d=20210323&t=2&i=1555848393&r=LYNXMPEH2M09S&w=800,2021-03-23T06:15:00Z,"By Reuters Staff
MANILA (Reuters) - The Philippines complained to China on Monday about what it described as the swarming and threatening presence of Chinese vessels in disputed waters in the South … [+2401 chars]"
56,"{'id': None, 'name': 'New York Times'}",Eric Lipton and Michael Forsythe,Inspector General’s Report Cites Elaine Chao for Misuse of Office,The report said the Justice Department declined to investigate her promotion of her family’s shipbuilding business while serving as transportation secretary in the Trump administration.,https://static01.nyt.com/images/2021/03/03/us/politics/03dc-chao/03dc-chao-facebookJumbo.jpg,2021-03-03T22:37:14Z,"Public servants, especially those responsible for leading tens of thousands of other public servants, must know that they serve the public and not their familys private commercial interests, said Rep… [+2204 chars]"
57,"{'id': 'reuters', 'name': 'Reuters'}",Reuters Staff,Blinken says China is acting aggressively and repressively - Reuters UK,"United States Secretary of State Antony Blinken told a roundtable of Japanese journalists on Wednesday that China is acting more aggressively and repressively, including in the East and South China Seas.",https://static.reuters.com/resources/r/?m=02&d=20210317&t=2&i=1555145086&r=LYNXMPEH2G04M&w=800,2021-03-17T02:26:00Z,"By Reuters Staff
FILE PHOTO: U.S. Secretary of State Antony Blinken attends a meeting with the Japanese Prime Minister Yoshihide Suga (not pictured) at the Prime Minister's office in Tokyo, Japan, M… [+268 chars]"
58,"{'id': 'engadget', 'name': 'Engadget'}",https://www.engadget.com/about/editors/chris-velazco,Legal questions linger as governments and companies keep pushing into space,"The Perseverance rover’s landing on Mars is still fresh in people’s memories, privately-owned companies are ferrying people and supplies into orbit, and NASA continues to work on “the most powerful rocket” it has ever built. But as world governments and priva…",https://s.yimg.com/os/creatr-uploaded-images/2021-03/3a9c8ae0-88e8-11eb-ae7b-a802532da6c2,2021-03-19T19:47:11Z,"The Perseverance rovers landing on Mars is still fresh in peoples memories, privately-owned companies are ferrying people and supplies into orbit, and NASA continues to work on the most powerful rock… [+4938 chars]"
59,"{'id': 'reuters', 'name': 'Reuters'}",Reuters Staff,Breakingviews - Capital Calls: China Telecom's homecoming glory - Reuters,Breakingviews - Capital Calls: China Telecom's homecoming glory  Reuters,https://static.reuters.com/resources/r/?m=02&d=20210310&t=2&i=1554351366&r=LYNXMPEH2909U&w=800,2021-03-10T05:43:00Z,"By Reuters Staff
A sign of China Telecom is seen on a street, during the coronavirus disease (COVID-19) outbreak in Shanghai, China January 8, 2021. REUTERS/Aly Song - RC2H3L9F1C49
HONG KONG (Reute… [+1600 chars]"
60,"{'id': 'reuters', 'name': 'Reuters'}",,China stocks end lower as policy tightening worries persist - Reuters,China stocks end lower as policy tightening worries persist  Reuters,,2021-03-15T07:42:49Z,"Financials
Reuters Staff
SHANGHAI, March 15 (Reuters) - China shares closed lower on Monday, with heavyweight consumer, healthcare and new energy stocks leading the losses, as the recent conservati… [+2083 chars]"
61,"{'id': 'reuters', 'name': 'Reuters'}",Reuters Staff,Capital Calls: Fonterra is milking China cash cow - Reuters,Capital Calls: Fonterra is milking China cash cow  Reuters,https://static.reuters.com/resources/r/?m=02&d=20210317&t=2&i=1555163843&r=LYNXMPEH2G0FH&w=800,2021-03-17T06:59:00Z,"By Reuters Staff
Fonterra's Anchor brand milk powder packets are seen on shelves at a shop in Colombo August 21, 2013. A Sri Lankan court on Wednesday issued a summons to Fonterra Brands Lanka, the … [+1843 chars]"
62,"{'id': 'reuters', 'name': 'Reuters'}",Reuters Staff,Breakingviews - Capital Calls: China chokes its vaping startups - Reuters,Breakingviews - Capital Calls: China chokes its vaping startups  Reuters,https://static.reuters.com/resources/r/?m=02&d=20210323&t=2&i=1555844278&r=LYNXMPEH2M07P&w=800,2021-03-23T05:26:00Z,"By Reuters Staff
A saleswoman demonstrates vaping at the Vape Shop that sells e-cigarette products in Beijing, China January 30, 2019. REUTERS/Thomas Peter 
HONG KONG (Reuters Breakingviews) - Conc… [+1647 chars]"
63,"{'id': 'reuters', 'name': 'Reuters'}",Reuters Staff,"China, Hong Kong stocks fall as western sanctions weigh - Reuters","China, Hong Kong stocks fall as western sanctions weigh  Reuters",https://s1.reutersmedia.net/resources_v2/images/rcom-default.png?w=800,2021-03-23T04:44:00Z,"By Reuters Staff
* Chinese and Hong Kong stocks fall more than 1%
* Western sanctions over human rights abuses hit risk appetite
* Concerns about policy tightening at home continue to weigh
SHANG… [+2677 chars]"
64,"{'id': 'bbc-news', 'name': 'BBC News'}",https://www.facebook.com/bbcnews,US and China trade angry barbs at high-level Alaska talks,This is the first high-level face-to-face meeting between the Biden administration and Beijing.,https://ichef.bbci.co.uk/news/1024/branded_news/14A2/production/_117628250_066305972.jpg,2021-03-19T02:16:25Z,"image captionIt was the first high-level direct meeting between the new US administration and China
US and Chinese officials have exchanged sharp rebukes in the first high-level talks between the Bi… [+2669 chars]"
65,"{'id': 'bbc-news', 'name': 'BBC News'}",https://www.facebook.com/bbcnews,Sea-cucumber divers off Liberia risk danger to feed a hunger in China,The starfish could represent a lucrative trade but they also play a key role on the coastal ecology.,https://ichef.bbci.co.uk/news/1024/branded_news/69A9/production/_117594072_lib3.jpg,2021-03-17T00:52:05Z,"image copyrightLucinda Rouse
image captionAbdoulaye Mansaray learnt about the business while processing sea cucumbers in Sierra Leone
Liberia may be sitting on a potentially valuable trade in sea c… [+7421 chars]"
66,"{'id': 'reuters', 'name': 'Reuters'}",Reuters Staff,China shares bounce higher; investors shrug off factory growth slowdown - Reuters,China shares bounce higher; investors shrug off factory growth slowdown  Reuters,https://s1.reutersmedia.net/resources_v2/images/rcom-default.png?w=800,2021-03-01T07:39:00Z,"By Reuters Staff
* Follows &gt;5% fall last week, biggest weekly drop in a year
* Factory activity growth slows in February
SHANGHAI, March 1 (Reuters) - China shares ended higher on Monday, rebou… [+1788 chars]"
67,"{'id': 'reuters', 'name': 'Reuters'}",Reuters Staff,"China stocks fall as consumers, material firms tumble; Hang Seng slips - Reuters","China stocks fall as consumers, material firms tumble; Hang Seng slips  Reuters",https://s1.reutersmedia.net/resources_v2/images/rcom-default.png?w=800,2021-03-04T04:39:00Z,"By Reuters Staff
* HK-&gt;Shanghai Connect daily quota used -3.2%, Shanghai-&gt;HK daily quota used 3%
* FTSE China A50 -2.7%
BEIJING/SHANGHAI, March 4 (Reuters) - Chinese shares fell on Thursday,… [+1451 chars]"
68,"{'id': 'reuters', 'name': 'Reuters'}",Reuters Staff,"China blue-chips drop most in over 7 months as consumer, material stocks slump - Reuters","China blue-chips drop most in over 7 months as consumer, material stocks slump  Reuters",https://s1.reutersmedia.net/resources_v2/images/rcom-default.png?w=800,2021-03-04T07:38:00Z,"By Reuters Staff
* HK-&gt;Shanghai Connect daily quota used -1.9%, Shanghai-&gt;HK daily quota used 0.1%
* FTSE China A50 flat
BEIJING/SHANGHAI, March 4 (Reuters) - Chinese shares dropped on Thurs… [+1549 chars]"
69,"{'id': 'reuters', 'name': 'Reuters'}",Reuters Staff,China shares reverse gains after regulator warns of inflow risks - Reuters,China shares reverse gains after regulator warns of inflow risks  Reuters,https://s1.reutersmedia.net/resources_v2/images/rcom-default.png?w=800,2021-03-02T07:32:00Z,"By Reuters Staff
* Shares erase early gains after regulator comment on inflows
* Foreign investors net sellers through Stock Connect
SHANGHAI, March 2 (Reuters) - Chinas benchmark stock indexes fe… [+1889 chars]"
70,"{'id': 'reuters', 'name': 'Reuters'}",,China reports 19 new mainland COVID-19 cases vs 13 a day earlier - Reuters,China reports 19 new mainland COVID-19 cases vs 13 a day earlier  Reuters,,2021-03-08T01:06:36Z,"Healthcare
Reuters Staff
March 8 (Reuters) - China reported 19 new COVID-19 cases on March 7, up from 13 a day earlier, the countrys national health authority said on Monday.
The National Health C… [+477 chars]"
71,"{'id': 'reuters', 'name': 'Reuters'}",Reuters Staff,UPDATE 1-German exports post surprise rise as China trade sizzles - Reuters,UPDATE 1-German exports post surprise rise as China trade sizzles  Reuters,https://s1.reutersmedia.net/resources_v2/images/rcom-default.png?w=800,2021-03-09T08:08:00Z,"By Reuters Staff
* Exports rise 1.4% m/m
* Increase surpasses all forecasts in Reuters poll
* Exports to China up 3.1% y/y (Adds detail, economist, background)
BERLIN, March 9 (Reuters) - German … [+1927 chars]"
72,"{'id': 'the-wall-street-journal', 'name': 'The Wall Street Journal'}",Stephanie Yang,"China Appears to Block Signal, One of Last Popular Encrypted Messaging Apps - The Wall Street Journal","<ol><li>China Appears to Block Signal, One of Last Popular Encrypted Messaging Apps  The Wall Street Journal
</li><li>Encrypted messaging app Signal appears to be blocked in China  CNBC
</li><li>Elon Musk-Backed Facebook Rival — Signal — Becomes Inaccessibl…",https://images.wsj.net/im-312068/social,2021-03-16T13:12:00Z,"TAIPEIMessaging app Signal became unusable for many people in mainland China this week, stifling one of the last widely used messaging apps that could send and receive encrypted messages in the count… [+1132 chars]"
73,"{'id': 'reuters', 'name': 'Reuters'}",,"China, US should lift COVID-19 travel bans if herd immunity reached, Chinese epidemiologist says - Reuters","China, US should lift COVID-19 travel bans if herd immunity reached, Chinese epidemiologist says  Reuters",,2021-03-02T02:07:12Z,"FILE PHOTO: A traveler walks past a Christmas tree as he makes his way through the Ronald Reagan Washington National Airport, in Arlington, Virginia, U.S., December 22, 2020. REUTERS/Kevin Lamarque/F… [+1605 chars]"
74,"{'id': 'reuters', 'name': 'Reuters'}",,"COLUMN-As Asia LNG price retreats, China storage looms as key issue: Russell - Reuters","COLUMN-As Asia LNG price retreats, China storage looms as key issue: Russell  Reuters",,2021-03-02T13:00:57Z,"Industry, Materials and Utilities
Clyde Russell
(The opinions expressed here are those of the author, a columnist for Reuters.)
* GRAPHIC- Spot Asian LNG prices by year: tmsnrt.rs/3sDWGfz
LAUNCES… [+3723 chars]"
75,"{'id': 'reuters', 'name': 'Reuters'}",,"China says it will crack down on counterfeit, low quality seeds - Reuters","China says it will crack down on counterfeit, low quality seeds  Reuters",,2021-03-02T12:01:57Z,"Basic Materials
Reuters Staff
BEIJING, March 2 (Reuters) - China will crack down on the production and sale of counterfeit, low quality seeds, the Ministry of Agriculture and Rural Affairs said on … [+269 chars]"
76,"{'id': 'reuters', 'name': 'Reuters'}",,US-blacklisted China Telecom plans estimated $4 bln Shanghai listing - Reuters,US-blacklisted China Telecom plans estimated $4 bln Shanghai listing  Reuters,,2021-03-09T15:33:47Z,"FILE PHOTO: The company logo of China Telecom is displayed at a news conference in Hong Kong, China August 20, 2018. REUTERS/Bobby Yip/File Photo
Media and Telecoms
Reuters Staff
SHANGHAI (Reuters… [+1541 chars]"
77,"{'id': 'reuters', 'name': 'Reuters'}","Tony Munroe, Kevin Yao","China tightens Hong Kong grip, sets modest GDP target as parliament begins - Reuters","China tightens Hong Kong grip, sets modest GDP target as parliament begins  Reuters",https://s1.reutersmedia.net/resources_v2/images/rcom-default.png?w=800,2021-03-05T06:53:00Z,"* China sets 2021 GDP forecast of more than 6%
* Beijing to reform Hong Kong electoral system as grip tightens
* Spending on R&amp;D to rise under new five-year plan
* Modest growth target seen fo… [+4120 chars]"
78,"{'id': 'reuters', 'name': 'Reuters'}",,China says door to Xinjiang 'always open' but UN rights boss should not prejudge - Reuters.com,China says door to Xinjiang 'always open' but UN rights boss should not prejudge  Reuters.com,,2021-03-02T10:19:52Z,"FILE PHOTO: Security guards stand at the gates of what is officially known as a vocational skills education centre in Huocheng County in Xinjiang Uighur Autonomous Region, China September 3, 2018. RE… [+962 chars]"
79,"{'id': 'reuters', 'name': 'Reuters'}",Reuters Staff,"China yuan firms but poised for 6th week of losses on dollar strength, China-West tensions - Reuters","China's yuan inched up on Friday, as Beijing vowed to continue to support its economy, though the currency was on track for its sixth week of losses due to a strengthening dollar and tensions between China and the West. The central bank said on Thursday China…",https://s1.reutersmedia.net/resources_v2/images/rcom-default.png?w=800,2021-03-26T05:01:22Z,"By Reuters Staff
SHANGHAI, March 26 (Reuters) - China's yuan inched up on
Friday, as Beijing vowed to continue to support its economy,
though the currency was on track for its sixth week of losses… [+3594 chars]"
