,source,author,title,description,urlToImage,publishedAt,content
75,"{'id': 'bbc-news', 'name': 'BBC News'}",https://www.facebook.com/bbcnews,US immigration: Disaster agency FEMA brought in to help with child migrant surge,US-Mexico border facilities are under pressure amid a rise in the number of unaccompanied children.,https://ichef.bbci.co.uk/news/1024/branded_news/64C4/production/_117569752_migrantcampepa.jpg,2021-03-14T08:33:31Z,"image captionGrowing numbers of migrants are arriving on the US border with Mexico each day
A US agency that normally deals with major emergencies and natural disasters has been brought in to help c… [+2108 chars]"
76,"{'id': 'bbc-news', 'name': 'BBC News'}",,En Vogue on re-recording classic for Coming 2 America,"The US girl group talk about their empowering 90s hits, money rumours and Coming 2 America.",https://ichef.bbci.co.uk/images/ic/400xn/p0998yqz.jpg,2021-03-12T09:13:21Z,"In 1993, two of the biggest groups in the world at the time - En Vogue and Salt N Pepa - teamed up to record Whatta Man, which became a worldwide smash and an all-time classic.
They've re-recorded t… [+497 chars]"
77,"{'id': 'bbc-news', 'name': 'BBC News'}",https://www.facebook.com/bbcnews,Covid-19: Miami imposes emergency curfew over spring break 'chaos',Large crowds on the US city's party strips prompted an emergency overnight curfew.,https://ichef.bbci.co.uk/news/1024/branded_news/CD9B/production/_117653625_mediaitem117653624.jpg,2021-03-21T16:55:47Z,"image captionA city official said the measures would help keep residents and visitors safe over the holiday period
A state of emergency has been declared in the US city of Miami over concerns large … [+2416 chars]"
78,"{'id': 'bbc-news', 'name': 'BBC News'}",https://www.facebook.com/bbcnews,Covid stimulus: Biden signs $1.9tn relief bill into law,The US government has now spent more than $5tn on recovery efforts during the pandemic.,https://ichef.bbci.co.uk/news/1024/branded_news/14021/production/_117535918_gettyimages-1231650547.jpg,2021-03-11T19:18:06Z,"image copyrightGetty Images
US President Joe Biden has signed a $1.9tn (£1.4tn) economic relief bill that aims to help Americans impacted by the Covid-19 pandemic into law.
The bill includes $1,400… [+5536 chars]"
79,"{'id': 'engadget', 'name': 'Engadget'}",Jon Fingas,Canada will invest billions to electrify mass transit,"Mass transit isn't getting much use during the pandemic, but Canada wants to be sure it's eco-friendly when the crisis is over. The Canadian government plans to invest $2.75 billion CAD (about $2.17 billion US) into electrifying mass transit across the countr…",https://s.yimg.com/uu/api/res/1.2/hQkIg7ESo1EZFd5cggOzCg--~B/aD0zMTU4O3c9NDc1NTthcHBpZD15dGFjaHlvbg--/https://s.yimg.com/os/creatr-uploaded-images/2021-03/abd84180-7ebc-11eb-9ffc-15f5fa272b75.cf.jpg,2021-03-06T21:27:38Z,"Mass transit isn't getting much use during the pandemic, but Canada wants to be sure it's eco-friendly when the crisis is over. The Canadian government plans to invest $2.75 billion CAD (about $2.17 … [+1067 chars]"
80,"{'id': 'engadget', 'name': 'Engadget'}",Jon Fingas,"China five-year plan aims for supremacy in AI, quantum computing","China's tech industry has been hit hard by US trade battles and the economic uncertainties of the pandemic, but it's eager to bounce back in the relatively near future. According to the Wall Street Journal, the country used its annual party meeting to outline…",https://s.yimg.com/uu/api/res/1.2/tG5BcRP87Q0hsapSMZLwAQ--~B/aD0zNDEyO3c9NTQwMDthcHBpZD15dGFjaHlvbg--/https://s.yimg.com/os/creatr-uploaded-images/2021-03/72abf6b0-7f91-11eb-9a27-fd00ec45aa19.cf.jpg,2021-03-07T22:56:18Z,"China's tech industry has been hit hard by US trade battles and the economic uncertainties of the pandemic, but it's eager to bounce back in the relatively near future. According to the Wall Street J… [+1218 chars]"
81,"{'id': 'engadget', 'name': 'Engadget'}",Richard Lawler,The Cash app's parent company is now running its own bank,"Jack Dorsey, the CEO of both Twitter and Square, tweeted today that the ""Bank now open."" What he's referring to is that now, about a year after receiving FDIC approval, Square Financial Services has begun operations. Operating as a subsidiary of Square, which…",https://s.yimg.com/uu/api/res/1.2/VZvN0NSNWQiKELgA1CIkUQ--~B/aD0zMDcxO3c9NDYwNjthcHBpZD15dGFjaHlvbg--/https://s.yimg.com/os/creatr-uploaded-images/2021-03/4e330bc0-7af0-11eb-bfef-bb05b3886636.cf.jpg,2021-03-02T00:44:43Z,"Jack Dorsey, the CEO of both Twitter and Square, tweeted today that the ""Bank now open."" What he's referring to is that now, about a year after receiving FDIC approval, Square Financial Services has … [+641 chars]"
82,"{'id': 'bbc-news', 'name': 'BBC News'}",https://www.facebook.com/bbcnews,Covid: How ethnicity and wealth affect US vaccine rollout,"People belonging to ethnic minorities are less likely to have been vaccinated, despite being more likely to develop Covid.",https://ichef.bbci.co.uk/news/1024/branded_news/13C98/production/_117584018_gettyimages-1304120807.jpg,2021-03-18T00:51:45Z,"By Jake HortonBBC Reality Check
image copyrightGetty Images
The US vaccination rollout among people belonging to ethnic minorities is significantly behind that of white Americans - and wealthier ar… [+4302 chars]"
83,"{'id': 'bbc-news', 'name': 'BBC News'}",https://www.facebook.com/bbcnews,Biden's $1.9tn Covid relief bill expected to pass US Congress,This sixth Covid-19 bill is one of the largest economic relief plans in US history.,https://ichef.bbci.co.uk/news/1024/branded_news/7455/production/_117518792_gettyimages-1231326098.jpg,2021-03-10T17:50:40Z,"image copyrightGetty Images
President Joe Biden's $1.9tn (£1.4tn) relief bill to help Americans deal with the impact of the Covid-19 pandemic is expected to soon pass Congress.
The Democratic-contr… [+2443 chars]"
84,"{'id': 'bbc-news', 'name': 'BBC News'}",https://www.facebook.com/bbcnews,'Exceptional' 15th-Century bowl unearthed at US yard sale,"A small bowl bought for $35 last year is set to be auctioned for between $300,000 and $500,000.",https://ichef.bbci.co.uk/news/1024/branded_news/209A/production/_117364380_157n10644-brycj-08.jpg,2021-03-03T07:53:50Z,"image captionThe 6-inch (16cm) diameter bowl features cobalt blue floral paintings
As far as antiques hunting goes, this might just be as good as it gets.
A small bowl bought for just $35 (£25) at … [+1827 chars]"
85,"{'id': 'bbc-news', 'name': 'BBC News'}",https://www.facebook.com/bbcnews,Afghanistan conflict: US warns of new Taliban 'spring offensive',"The militant group could make rapid gains in Afghanistan when US troops pull out, officials say.",https://ichef.bbci.co.uk/news/1024/branded_news/268C/production/_117486890_tv065653159.jpg,2021-03-08T00:56:23Z,"image captionUS and Nato troops have helped train members of the Afghan security forces
The Taliban could make rapid military gains across Afghanistan when American and Nato troops pull out, US Secr… [+3113 chars]"
86,"{'id': None, 'name': 'New York Times'}",Elisabeth Vincentelli,Theater to Stream: Star-Studded Digital Shorts and Escape Rooms,The past year has made us rethink the boundaries between theater and film. Many of these shows are a little bit of both.,https://static01.nyt.com/images/2021/03/03/arts/03streaming-theater-1/03streaming-theater-1-facebookJumbo.jpg,2021-03-03T15:00:11Z,"If anybody knows how to straddle the physical and virtual, its the playwright and screenwriter Qui Nguyen. On March 10, Nguyen, the author of the hit show She Kills Monsters, will participate in a Q.… [+967 chars]"
87,"{'id': None, 'name': 'New York Times'}",Laura Collins-Hughes,Battered but Unbowed: How Beckett Speaks to a New Era,"Adaptations of “Happy Days” and “First Love,” works by the master of existential wheel-spinning, show us how to live in place.",https://static01.nyt.com/images/2021/03/09/arts/07happypix/07happypix-facebookJumbo-v2.jpg,2021-03-08T17:10:50Z,"Presented by the Wild Project in association with Princeton Universitys Fund for Irish Studies, Krells Happy Days doesnt find the ache in all that, or the leavening humor. Its Winnie, with her rictus… [+1487 chars]"
88,"{'id': 'bbc-news', 'name': 'BBC News'}",https://www.facebook.com/bbcnews,Covid: Texas and Mississippi lifting restrictions too soon?,"Two US states are lifting compulsory coronavirus restrictions, but are they in a position to do so?",https://ichef.bbci.co.uk/news/1024/branded_news/7FF8/production/_117506723_austin_mask_gettyimages-1231493646.jpg,2021-03-11T00:44:08Z,"By Jake HortonBBC Reality Check
image captionTexas is some way off reaching wider immunity through vaccinations
The governors of the US states of Texas and Mississippi have lifted all compulsory Co… [+5192 chars]"
89,"{'id': 'bbc-news', 'name': 'BBC News'}",https://www.facebook.com/bbcnews,Covid vaccines: Why some Americans are choosy about their jab,"There are three options in the US, and some are turning their nose up at one of them.",https://ichef.bbci.co.uk/news/1024/branded_news/140FC/production/_117627128_gettyimages-1307812156.jpg,2021-03-21T00:24:28Z,"By Cache McClayBBC News, Washington
image copyrightGetty Images
America has three vaccines approved for distribution, and now people are getting choosy about which they want.
All three have been s… [+6773 chars]"
90,"{'id': None, 'name': 'Lifehacker.com'}","Meghan Moravcik Walbert on Offspring, shared by Meghan Moravcik Walbert to Lifehacker",How to Help Your Struggling Tween,"We’re just about a year into this pandemic, and it’s been hard on basically everyone. From toddlers who can’t socialize with their little toddler friends to the elderly who haven’t hugged a single family member in a year, each one of us has been negatively im…","https://i.kinja-img.com/gawker-media/image/upload/c_fill,f_auto,fl_progressive,g_center,h_675,pg_1,q_80,w_1200/puovqype7wjhyakyttpv.jpg",2021-03-03T14:30:00Z,"Were just about a year into this pandemic, and its been hard on basically everyone. From toddlers who cant socialize with their little toddler friends to the elderly who havent hugged a single family… [+6424 chars]"
91,"{'id': None, 'name': 'Lifehacker.com'}","Meghan Moravcik Walbert on Offspring, shared by Meghan Moravcik Walbert to Lifehacker",I'm an Atheist; How Do I Talk to My Kids About Religion?,"When it comes to religion, parents—atheist parents, in particular—may find themselves stumbling to explain to their kids why other families believe in certain things, but we don’t. There are an endless amount of “Big Talks” we have with our kids over the cour…","https://i.kinja-img.com/gawker-media/image/upload/c_fill,f_auto,fl_progressive,g_center,h_675,pg_1,q_80,w_1200/nz59dvh4xmt26cjetnco.jpg",2021-03-04T15:30:00Z,"When it comes to religion, parentsatheist parents, in particularmay find themselves stumbling to explain to their kids why other families believe in certain things, but we dont. There are an endless … [+9252 chars]"
92,"{'id': 'bbc-news', 'name': 'BBC News'}",https://www.facebook.com/bbcnews,Andrew Cuomo: Biden declines to join calls for Cuomo to resign,The US president wants to await the outcome of a misconduct probe into NY Governor Andrew Cuomo.,https://ichef.bbci.co.uk/news/1024/branded_news/16E97/production/_117574839_1f49c5c9-1ce3-48ce-a551-26d4b83ac42f.jpg,2021-03-15T01:42:49Z,"image captionPresident Joe Biden (left) made his comments to reporters at the White House
US President Joe Biden has urged people to await the results of an inquiry into sexual misconduct allegation… [+2515 chars]"
93,"{'id': 'bbc-news', 'name': 'BBC News'}",https://www.facebook.com/bbcnews,Michelle Obama voices sympathy for Meghan on race,The former US first lady reacts to Oprah Winfrey's interview with the Duke and Duchess of Sussex.,https://ichef.bbci.co.uk/news/1024/branded_news/B8E1/production/_117592374_gettyimages-857192646-594x594.jpg,2021-03-16T11:11:17Z,"image captionFormer First Lady Michelle Obama said she hoped there would be ""forgiveness""
Former US First Lady Michelle Obama has said it ""wasn't a complete surprise"" to hear the Duchess of Sussex t… [+2678 chars]"
94,"{'id': 'bbc-news', 'name': 'BBC News'}",https://www.facebook.com/bbcnews,Biden says his dog Major will return to the White House after biting incident,"Major, one of the US president's two dogs, left the White House after an alleged biting incident.",https://ichef.bbci.co.uk/news/1024/branded_news/B608/production/_117600664_a6ce25cd-62c1-43ec-b1df-42b3f17e01a8.jpg,2021-03-17T19:51:46Z,"image captionMajor, the White House's first rescue pup, was accused of biting a Secret Service agent earlier this month
US President Joe Biden has defended his dog Major after reports the dog bit so… [+2405 chars]"
95,"{'id': 'bbc-news', 'name': 'BBC News'}",https://www.facebook.com/bbcnews,Jessica Walter: Arrested Development star dies aged 80,"The US actress played the icy matriarch Lucille Bluth, and starred in films like Play Misty for Me.",https://ichef.bbci.co.uk/news/1024/branded_news/451C/production/_101729671_hi046887183.jpg,2021-03-25T19:47:30Z,"image captionJessica Walter played Lucille Bluth in the cult TV show Arrested Development
The award-winning US actress Jessica Walter has died aged 80, her family say.
""It is with a heavy heart tha… [+1224 chars]"
96,"{'id': 'bbc-news', 'name': 'BBC News'}",,Why is everyone fighting over the South China Sea?,China claims most of it but surrounding countries and the US disagree. The BBC's Zhaoyin Feng explains why.,https://ichef.bbci.co.uk/images/ic/400xn/p09b95tx.jpg,2021-03-20T00:06:32Z,"The South China Sea is one of the most disputed regions in the world. China claims most of it but surrounding countries and the US disagree.
Tension is building and the area is becoming a regional f… [+109 chars]"
97,"{'id': 'cnn', 'name': 'CNN'}",Opinion by Jorge G. Castaneda,Opinion: Biden should team up with Mexico,"Mexico's President Andrés Manuel López Obrador announced that he would submit an immigration proposal to President Joe Biden on allowing temporary workers to come to the US, writes Jorge Castañeda, while Biden's proposed Citizenship Act seeks to legalize undo…",https://cdn.cnn.com/cnnnext/dam/assets/210302095327-biden-obrador-meeting-super-tease.jpg,2021-03-11T22:32:03Z,Jorge G. Castañeda was Mexico's foreign minister from 2000 to 2003. He is a professor at New York University. The views expressed in this commentary are those of the author. View more opinion article… [+5659 chars]
98,"{'id': 'bbc-news', 'name': 'BBC News'}",,Anti-Asian violence: 'He slashed me from cheek-to-cheek',Asian Americans across the US have faced a surge in hate crimes during the pandemic.,https://ichef.bbci.co.uk/images/ic/400xn/p09b59zy.jpg,2021-03-19T01:23:54Z,"Asian Americans across the US have faced a surge in discrimination and hate crimes during the pandemic. The BBC's Larry Madowo spoke with victims, organisers and experts in New York and San Francisco… [+65 chars]"
99,"{'id': 'bbc-news', 'name': 'BBC News'}",https://www.facebook.com/bbcnews,Iraq rocket attack: Air base hosting US-led coalition forces targeted,The attack comes days after the US carried out air strikes on Iran-backed Iraqi militias in Syria.,https://ichef.bbci.co.uk/news/1024/branded_news/AA4A/production/_117349534_gettyimages-1193597165.jpg,2021-03-03T10:08:29Z,"image captionUS-led coalition forces are stationed at Al Asad air base to combat the Islamic State group
Ten rockets have hit a base hosting US-led coalition forces in western Iraq.
Iraq's military… [+1392 chars]"
