,source,author,title,description,urlToImage,publishedAt,content
0,"{'id': 'engadget', 'name': 'Engadget'}",https://www.engadget.com/about/editors/steve-dent,Tesla now accepts Bitcoin in the US,"As it promised earlier this year, Tesla now accepts payment in Bitcoin, according to Tesla's website and a tweet from CEO Elon Musk.",https://s.yimg.com/os/creatr-uploaded-images/2021-03/d3bc78e0-8116-11eb-87fb-7bddf8711d48,2021-03-24T08:29:16Z,"As it promised earlier this year, Tesla now accepts payment in Bitcoin, according to Tesla's website and a tweet from CEO Elon Musk. In a subsequent tweet, Musk said that ""Bitcoin paid to Tesla will … [+1390 chars]"
1,"{'id': 'wired', 'name': 'Wired'}",Albert Fox Cahn,Vaccine Passports Can Help the US Reopen—or Further Divide Us,"Overly restrictive “yellow cards” could end up disproportionately excluding Black and Latinx citizens from jobs, schools, or even the neighborhood market.","https://media.wired.com/photos/603d75c49ce0b4203085d962/191:100/w_1280,c_limit/OpEd-Covid-Vaccine-Passport-1231007653.jpg",2021-03-02T14:00:00Z,"Having a passport in your pocket can at times feel almost magical. Borders fade away, immigration queues disappear, and suddenly the world feels more accessible. For those of us lucky enough to have … [+4451 chars]"
2,"{'id': None, 'name': 'Lifehacker.com'}",Sam Blum,Send Us Your Relationship Questions for Some 'Tough Love',"After a too-long hiatus, Lifehacker’s relationship column Tough Love is returning. The column’s new iteration will be written by me, and I’m very excited to forge a deep relationship with the site’s readers by helping them with their romantic, personal and ex…","https://i.kinja-img.com/gawker-media/image/upload/c_fill,f_auto,fl_progressive,g_center,h_675,pg_1,q_80,w_1200/jlz9v75gbezd1epzceez.png",2021-03-02T16:45:00Z,"After a too-long hiatus, Lifehackers relationship column Tough Love is returning. The columns new iteration will be written by me, and Im very excited to forge a deep relationship with the sites read… [+2192 chars]"
3,"{'id': 'wired', 'name': 'Wired'}",Adam Rogers,The Raging Evolutionary War Between Humans and Covid-19,"Fighting the pandemic isn’t only about vaccines and drugs. It’s about understanding how viruses mutate and change inside us, and among us.","https://media.wired.com/photos/60395f5a490220e41e906b90/191:100/w_1280,c_limit/Science_covidevolution_1257547744.jpg",2021-03-01T12:00:00Z,"The race is on. Vaccines against the virus that causes Covid-19 are needling into shoulders around the world, the tip-of-the-hypodermic spear of a year-long scientific triumph. But that protean virus… [+4050 chars]"
4,"{'id': None, 'name': 'Lifehacker.com'}",Aisha Jordan,11 Movies and Shows That Will Inspire You to Try Something New,"The movies and TV we watch are more than just entertainment—they have the ability to impact our behavior. Inspiring characters and storylines can teach us something new and spur us to change our thinking, or even our lives. The change doesn’t even have to be …","https://i.kinja-img.com/gawker-media/image/upload/c_fill,f_auto,fl_progressive,g_center,h_675,pg_1,q_80,w_1200/i5pindq9assl2q4dqtny.png",2021-03-19T16:30:00Z,A League of Their Own is based on the first All-American Girls Professional Baseball League (AAGPBL) which began in the early 1940s. Sisters Dottie Hinson (Gina Davis) and Kit Keller (Lori Petty) joi… [+594 chars]
5,"{'id': None, 'name': 'Lifehacker.com'}",Elizabeth Yuko,How to Use Daydreams to Ward off Boredom,"Remember being at church or a school assembly as a kid and letting your mind wander, and then all of a sudden, the boring event was over? Daydreaming took us out of the place we were physically located and brought us basically anywhere else, and made the time…","https://i.kinja-img.com/gawker-media/image/upload/c_fill,f_auto,fl_progressive,g_center,h_675,pg_1,q_80,w_1200/k5gzwib6uzfhffmnmrqt.jpg",2021-03-07T14:30:00Z,"Remember being at church or a school assembly as a kid and letting your mind wander, and then all of a sudden, the boring event was over? Daydreaming took us out of the place we were physically locat… [+2705 chars]"
6,"{'id': 'engadget', 'name': 'Engadget'}",https://www.engadget.com/about/editors/kris-holt,Google will split a $3 million COVID-19 fact-checking fund among 11 projects,Univision will create bilingual videos to combat misinformation among Hispanic residents in the US.,https://s.yimg.com/os/creatr-uploaded-images/2021-03/9aaa11c0-81b6-11eb-9ee7-3746b582134f,2021-03-16T13:00:04Z,Google News Initiative (GNI) has revealed the 11 projects that will receive funding to provide accurate information about COVID-19 vaccines. The goal is to reach people who are underserved by other f… [+1886 chars]
7,"{'id': 'wired', 'name': 'Wired'}",WIRED Staff,Soothe Yourself With a Picture Book About the Internet Dying,"“Let us bake a pie, though we know not which recipe is rated highest.”","https://media.wired.com/photos/6050e82467c8dbe8ab36aab0/191:100/w_1280,c_limit/OFF-Interview-Top-ART.jpg",2021-03-18T13:00:00Z,"In the beginningGore created the internet, and for a while it wasnt completely awful. Nyan Cat begat Grumpy Cat, the Ice Bucket Challenge begat the Dress, and the birds practically angered themselves… [+3890 chars]"
8,"{'id': 'wired', 'name': 'Wired'}",Angela Watercutter,Social Media Reminds Us of the Year That Wasn’t,"Technology is designed to conjure up warm, fond memories. But the anniversary of lockdown has brought on a period of mourning.","https://media.wired.com/photos/604a8cf84dccef2645d3896e/191:100/w_1280,c_limit/Culture_pandemic_monitor_1221103642.jpg",2021-03-12T17:05:00Z,"The Monitor is a weekly columndevoted to everything happening in the WIRED world of culture, from movies to memes, TV to Twitter.
Ever since the advent of the Gregorian calendar, human memory has be… [+3193 chars]"
9,"{'id': 'engadget', 'name': 'Engadget'}",https://www.engadget.com/about/editors/igor-bonifacic,Now Apple Maps can help you find COVID-19 vaccination sites,"Starting today, people in the US can use Apple Maps to find nearby COVID-19 vaccination sites.",https://s.yimg.com/os/creatr-uploaded-images/2021-03/bab967c0-86a9-11eb-bff9-2ad6c11278a5,2021-03-16T23:06:38Z,"Starting today, people in the US can use Apple Maps to find nearby COVID-19 vaccination sites. You can find the locations by tapping on the search bar and then the COVID-19 Vaccines icon under the ""F… [+1000 chars]"
10,"{'id': 'wired', 'name': 'Wired'}","Daniel Kreiss, Shannon McGregor",Facebook's Oversight Board Must Uphold the Ban on Trump,It's not just about penalizing the former president. It's about protecting democracy—in the US and around the world.,"https://media.wired.com/photos/6039699be9471794a22f0a88/191:100/w_1280,c_limit/Oped-Facebook-Oversight-Trump-1231037349%25202.jpg",2021-03-01T13:00:00Z,"In the coming weeks, the Facebook Oversight Board will rule on Donald Trumps indefinite suspension from the platform. This will surely be the Boards most important ruling to-date. The Boards specific… [+4898 chars]"
11,"{'id': 'engadget', 'name': 'Engadget'}",https://www.engadget.com/about/editors/saqib-shah,US charges CEO of company selling encrypted devices to drug traffickers,"The US Department of Justice has charged two individuals associated with encrypted phone software maker Sky Global, including the company's CEO, for allegedly facilitating global drug trafficking organizations.",https://s.yimg.com/uu/api/res/1.2/i.KFSBEWW2bgEDxplCyoOA--~B/aD0xNzAxO3c9MjY0NDthcHBpZD15dGFjaHlvbg--/https://s.yimg.com/os/creatr-uploaded-images/2021-03/55195440-8585-11eb-b57f-1de02853bf2a.cf.jpg,2021-03-15T12:15:52Z,The US Department of Justice (DoJ) has announced an indictment against the head and associate of a Canada-based company that allegedly supplied custom encrypted phones to international drug trafficke… [+2142 chars]
12,"{'id': 'techcrunch', 'name': 'TechCrunch'}",Natasha Lomas,Jobandtalent takes $120M from Softbank to enter the US market,"Spain’s Jobandtalent, a digital temp staffing agency startup which operates a dual-sided platform that matches temps with employers needing casual labor in sectors like ecommerce, warehousing, logistics and manufacturing, has grabbed €100 million (~$120M) in …",https://techcrunch.com/wp-content/uploads/2021/03/Series-D-image.png?w=712,2021-03-10T00:01:15Z,"Spain’s Jobandtalent, a digital temp staffing agency startup which operates a dual-sided platform that matches temps with employers needing casual labor in sectors like ecommerce, warehousing, logist… [+5144 chars]"
13,"{'id': 'techcrunch', 'name': 'TechCrunch'}",Sarah Perez,"YouTube’s TikTok rival, YouTube Shorts, arrives in the US","YouTube Shorts, the company’s short-form video experience and TikTok rival, is launching today in the U.S. The feature allows creators to record, edit and share short-form video content that’s 60 seconds or less in length, optionally set to popular music. At …",https://techcrunch.com/wp-content/uploads/2019/09/youtube-ios-app.jpg?w=712,2021-03-18T13:00:00Z,"YouTube Shorts, the company’s short-form video experience and TikTok rival, is launching today in the U.S. The feature allows creators to record, edit and share short-form video content that’s 60 sec… [+6262 chars]"
14,"{'id': 'techcrunch', 'name': 'TechCrunch'}",Anthony Ha,Daily Crunch: YouTube’s TikTok rival launches in the US,"YouTube Shorts comes to the U.S., Amazon starts testing electric delivery vans in San Francisco and new data suggests the impact of Google Play’s recent changes. This is your Daily Crunch for March 18, 2021. The big story: YouTube’s TikTok rival launches in t…",https://techcrunch.com/wp-content/uploads/2020/06/GettyImages-1149449078-e1610399732853.jpg?w=760,2021-03-18T22:14:34Z,"YouTube Shorts comes to the U.S., Amazon starts testing electric delivery vans in San Francisco and new data suggests the impact of Google Play’s recent changes. This is your Daily Crunch for March 1… [+3268 chars]"
15,"{'id': 'techcrunch', 'name': 'TechCrunch'}",Aria Alamalhodaei,Hyzon Motors’ hydrogen fuel ambitions include two US factories,"Hyzon Motors plans to produce fuel cells, including a critical component required to power hydrogen vehicles, at two U.S. factories in a move aimed at kickstarting domestic production at a commercial scale. The hydrogen-powered truck and bus manufacturer has …",https://techcrunch.com/wp-content/uploads/2021/03/HYZON-truck.jpg?w=533,2021-03-02T00:32:33Z,"Hyzon Motors plans to produce fuel cells, including a critical component required to power hydrogen vehicles, at two U.S. factories in a move aimed at kickstarting domestic production at a commercial… [+4636 chars]"
16,"{'id': 'wired', 'name': 'Wired'}",Chris Wright,NASA Gets a Quick Peek at a Mysterious Layer of the Sun,A new map of the chromosphere’s magnetic field could help us predict solar weather patterns—and anticipate flares that wreak havoc on the power grid.,"https://media.wired.com/photos/604bed80cefad00476a04ed1/191:100/w_1280,c_limit/Science_chromosphere_1221664954.jpg",2021-03-15T12:00:00Z,"Imagine for a minute that you have been transported to the middle layers of the suns atmosphere. The suns surface, the visible disc scientists call the photosphere, boils below you, red-hot plasma he… [+3443 chars]"
17,"{'id': 'the-verge', 'name': 'The Verge'}",Chaim Gartenberg,Taser maker Axon teams up with Skydio to sell drones directly to cops,"Axon has announced a new partnership with US-based drone manufacturer Skydio to sell drones with Axon’s software directly to law enforcement groups. The new deal is Axon’s second: it originally worked with DJI, but the China-based drone company is no longer p…",https://cdn.vox-cdn.com/thumbor/jAez6nfJ0H8cxcDCwVR3XKH3TSo=/45x0:1955x1000/fit-in/1200x630/cdn.vox-cdn.com/uploads/chorus_asset/file/20081367/Skydio_X2_commercial_drone.jpg,2021-03-11T16:35:52Z,"Following the tarnishing of DJIs image for government drone work
Image: Skydio
Axon the law enforcement company that makes Tasers, police body cameras, and other police and military technologies ha… [+2808 chars]"
18,"{'id': 'engadget', 'name': 'Engadget'}",https://www.engadget.com/about/editors/chris-velazco,Watch Samsung's Galaxy Awesome Unpacked with us live at 9:40AM ET,"Samsung usually saves its Unpacked events for its flashiest, highest-profile product launches, but today — well, things might be a little different. When the company kicks off its third major online event in as many months at 10:00 AM Eastern/7:00 AM Pacific …",https://s.yimg.com/os/creatr-uploaded-images/2021-03/39350b30-86f1-11eb-acdd-26cf199815f6,2021-03-17T12:47:13Z,"Samsung usually saves its Unpacked events for its flashiest, highest-profile product launches, but today well, things might be a little different. When the company kicks off its third major online ev… [+1151 chars]"
19,"{'id': 'engadget', 'name': 'Engadget'}",https://www.engadget.com/about/editors/kris-holt,The upcoming 'Among Us' account system is mostly about making the game safer,Innersloth plans to add a friends system and cross-platform cosmetics later.,https://s.yimg.com/os/creatr-uploaded-images/2021-03/02af4820-8cd0-11eb-bff7-ca4287868a97,2021-03-24T18:58:30Z,"When the latest Among Us
map arrives next week
, Innersloth will add an persistent account system
 to the hit game. Although it won't be mandatory to create an account, some features will be locke… [+1392 chars]"
20,"{'id': None, 'name': 'Lifehacker.com'}","Claire Lower on Skillet, shared by Claire Lower to Lifehacker",Should You Add Cheetos to Your Macaroni?,"I love innovation and, for the most part, I think preciousness around certain foods does us all a disservice, but some things are indefensible, and this one, particular blonde lady must be stopped. Read more...","https://i.kinja-img.com/gawker-media/image/upload/c_fill,f_auto,fl_progressive,g_center,h_675,pg_1,q_80,w_1200/gclobspeiaaxehxor2z9.png",2021-03-02T14:00:00Z,"I love innovation and, for the most part, I think preciousness around certain foods does us all a disservice, but some things are indefensible, and this one, particular blonde lady must be stopped. … [+1627 chars]"
21,"{'id': None, 'name': 'Lifehacker.com'}",Meghan Moravcik Walbert,How to Get Your Vaccine Card Laminated for Free,Staples must have seen all the attention Krispy Kreme is getting for handing out free doughnuts to vaccinated people all year long—with proof via a valid vaccination card—because now they’re offering to laminate those cards for all of us for free. In the late…,"https://i.kinja-img.com/gawker-media/image/upload/c_fill,f_auto,fl_progressive,g_center,h_675,pg_1,q_80,w_1200/fqtdqf10g4muomleroii.jpg",2021-03-26T13:30:00Z,Staples must have seen all the attention Krispy Kreme is getting for handing out free doughnuts to vaccinated people all year longwith proof via a valid vaccination cardbecause now theyre offering to… [+1494 chars]
22,"{'id': None, 'name': 'Lifehacker.com'}","Meghan Moravcik Walbert on Offspring, shared by Meghan Moravcik Walbert to Lifehacker",The Best Books to Teach Your Kid About Grief and Loss,"When we want to convey a difficult or abstract concept to our kids, whether it be empathy, racism, anxiety, or bullying, we often turn to children’s books for help. These books can help us introduce topics and ideas we otherwise struggle to put into our own w…","https://i.kinja-img.com/gawker-media/image/upload/c_fill,f_auto,fl_progressive,g_center,h_675,pg_1,q_80,w_1200/vnsp1hhmh4yrtyd0f1gz.jpg",2021-03-23T17:30:00Z,"When we want to convey a difficult or abstract concept to our kids, whether it be empathy, racism, anxiety, or bullying, we often turn to childrens books for help. These books can help us introduce t… [+6613 chars]"
23,"{'id': 'engadget', 'name': 'Engadget'}",Kris Holt,US plans 'a mix of actions' against Russia over SolarWinds cyberattack,"The US is preparing to retaliate against Russia after determining the country was probably involved
 in the SolarWinds cyberattack. Without providing specifics, White House press secretary Jen Psaki confirmed to CNBC that the government will carry out ""a mix…",https://s.yimg.com/uu/api/res/1.2/WCv39iFAiSk.3sqkBr9mJg--~B/aD01Nzc0O3c9ODY2MDthcHBpZD15dGFjaHlvbg--/https://s.yimg.com/os/creatr-uploaded-images/2020-12/3221b6f0-410e-11eb-9fd7-0bdca54435fa.cf.jpg,2021-03-08T16:55:25Z,"The US is preparing to retaliate against Russia after determining the country was probably involved
 in the SolarWinds cyberattack. Without providing specifics, White House press secretary Jen Psaki… [+1266 chars]"
24,"{'id': 'engadget', 'name': 'Engadget'}",Mariella Moon,"Microsoft email server flaws exploited to hack at least 30,000 US organizations","The emergency security patch Microsoft rolled out a few days ago to fix four zero-day flaws in Exchange Server didn't deter the hacking group that's been exploiting them. In fact, according to Krebs on Security and Wired, the the Chinese state-sponsored group…",https://s.yimg.com/uu/api/res/1.2/PLbFcIP9bCQhwkpWDsJtFQ--~B/aD0zNjk1O3c9NTU0MjthcHBpZD15dGFjaHlvbg--/https://s.yimg.com/os/creatr-images/2019-09/4f8e0af0-d13d-11e9-85cf-23cf45224ba3.cf.jpg,2021-03-06T04:33:24Z,"The emergency security patch Microsoft rolled out a few days ago to fix four zero-day flaws in Exchange Server didn't deter the hacking group that's been exploiting them. In fact, according to Krebs … [+2703 chars]"
25,"{'id': 'wired', 'name': 'Wired'}",Jason Parham,What Do TV’s Race Fantasies Actually Want to Say?,"Shows like 'Bridgerton' and 'Hollywood' alter the past in the name of inclusion. It would benefit us more to write the world as it was, as it is.","https://media.wired.com/photos/60395b439ce0b4203085d94e/191:100/w_1280,c_limit/Culture_BRIDGERTON_108_Unit_00543R.jpg",2021-03-02T14:00:00Z,"Not all fantasies are created equal. Take Bridgerton, the multiracial British period drama that is producer Shonda Rhimes first show for Netflix. It was an unprecedented hit: Reaching 82 million hous… [+3669 chars]"
26,"{'id': 'wired', 'name': 'Wired'}",Eric Niiler,The Tide Is High–and Getting Higher,A trove of historic records show that dredging and sea level rise are making nuisance high tides worse along the US coasts.,"https://media.wired.com/photos/604299c5bc9d842459e763c0/191:100/w_1280,c_limit/Science_hightide_1228230075.jpg",2021-03-08T12:00:00Z,"Living near the ocean is a dream for many people. But in recent years, the effects of climate change have made it a dicey proposition. Hurricanes have become more intense, leading to bigger storm sur… [+3871 chars]"
27,"{'id': 'engadget', 'name': 'Engadget'}",https://www.engadget.com/about/editors/mariella-moon,FBI report reveals cybercrime victims lost $4.2 billion in 2020,"The FBI's Internet Crime Complaint Center (IC3) has published its annual report (PDF) for 2020, wherein it revealed that cybercrime victims in the US reported a total loss of $4.2 billion for the year.",https://s.yimg.com/os/creatr-images/2019-12/3373cf40-177d-11ea-bf5f-4f7b7d626799,2021-03-18T12:20:48Z,"The FBI's Internet Crime Complaint Center (IC3) has published its annual report (PDF) for 2020, and it revealed that cybercrime victims in the US reported a total loss of $4.2 billion for the year. T… [+2049 chars]"
28,"{'id': 'the-verge', 'name': 'The Verge'}",Nicole Wetsman,Adjusted AstraZeneca data shows COVID-19 vaccine 76 percent effective,AstraZeneca released new data on its COVID-19 vaccine after US health officials rebuked its first press release. The company released incomplete data. The vaccine appears effective.,https://cdn.vox-cdn.com/thumbor/jfkZWS8mK3qGxWf2P0wPVG6r_hQ=/0x146:2040x1214/fit-in/1200x630/cdn.vox-cdn.com/uploads/chorus_asset/file/22357718/acastro_210309_1777_vaccine_0002.jpg,2021-03-25T12:35:54Z,"Federal officials publicly rebuked the company earlier this week
Illustration by Alex Castro / The Verge
AstraZeneca released updated data on its COVID-19 vaccine, saying a more recent analysis sho… [+2413 chars]"
29,"{'id': 'cnn', 'name': 'CNN'}","Opinion by Richard Galant, CNN",Opinion: Who's teaching us to hate,Where does the hate come from? That was the question on many people's minds after the killing of women at three spas in Georgia on Tuesday drew even more attention to the targeting of Asian Americans in the year since the coronavirus pandemic was declared.,https://cdn.cnn.com/cnnnext/dam/assets/210319015727-01-atlanta-shooting-memorial-0318-super-tease.jpg,2021-03-21T12:00:23Z,"Sign up to get our new weekly column as a newsletter. We're looking back at the strongest, smartest opinion takes of the week from CNN and other outlets.
 (CNN)Where does the hate come from? That wa… [+15302 chars]"
30,"{'id': 'cnn', 'name': 'CNN'}","Jen Christensen, CNN",US coronavirus vaccine rollout becomes 'less messy',"In December, then President-elect Joe Biden set a goal of getting 100 million people vaccinated against Covid-19 in the first 100 days of his presidency. At this rate, it looks like US will hit that mark on Friday, which is day 58.",https://cdn.cnn.com/cnnnext/dam/assets/210318180843-nurse-holds-a-vaccine-super-tease.jpeg,2021-03-19T00:04:50Z,"(CNN)In December, then President-elect Joe Biden set a goal of getting 100 million people vaccinated against Covid-19 in the first 100 days of his presidency. At this rate, it looks like US will hit … [+7818 chars]"
31,"{'id': 'wired', 'name': 'Wired'}",Angela Watercutter,Watch Us Sing Sea Chanteys on Twitch With The Longest Johns,"The WIRED crew will be playing a little 'Sea of Thieves' too, matey.","https://media.wired.com/photos/60429b9a4dccef2645d38937/191:100/w_1280,c_limit/Culture_seashanty_1048813758.jpg",2021-03-08T15:00:00Z,"Like a lot of people, we here at WIRED have spent a good portion of these early weeks of 2021 obsessed with sea chanteys. Although the merchant marine songs date back to the 19th century, they recent… [+1134 chars]"
32,"{'id': 'wired', 'name': 'Wired'}",Sarah Ruth Bates,The Game Walden Shows Us That Some Things Can’t Be Digitized,"It invites players to ""live deliberately"" in the woods, as Thoreau did—but it's not an experience you can easily replicate.","https://media.wired.com/photos/60414e03f02d2d2aebd21242/191:100/w_1280,c_limit/games_walden.jpg",2021-03-05T13:00:00Z,"In the book Walden, Thoreau writes scene after scene of his adventures by the pond, each recounted with specificity and delight. I especially love his story about fishing by moonlight.
These experie… [+3626 chars]"
33,"{'id': None, 'name': 'New York Times'}",Jeff Asher,US Murder Rate Remains Elevated as New Reporting System Begins,"A new system will be a “leap forward,” but in the short term it may hurt the public’s ability to evaluate key trends during a volatile period.",https://static01.nyt.com/images/2021/03/16/upshot/16up-crime-stats-sub/16up-crime-stats-sub-facebookJumbo.jpg,2021-03-16T09:00:12Z,"The F.B.I. has two basic national crime data collection systems that it relies on to create estimates of local and national trends. One is the Summary Reporting System (S.R.S.), which has two main pr… [+1771 chars]"
34,"{'id': 'the-verge', 'name': 'The Verge'}",Taylor Lyles,Microsoft reiterates ‘VR for console is not a focus for us’ following localization bug,"Following a pop-up message that hinted at VR support for Xbox Series X, Microsoft debunked the rumors of the new hardware citing it VR for console is not a focus for the company at this time.",https://cdn.vox-cdn.com/thumbor/42ej3mdIIijjy63TWR0wD5Wl6HQ=/0x146:2040x1214/fit-in/1200x630/cdn.vox-cdn.com/uploads/chorus_asset/file/11515155/acastro_180604_1777_xbox_0001.jpg,2021-03-16T21:05:01Z,"A VR headset for Xbox is not coming anytime soon
Illustration by Alex Castro / The Verge
Microsoft has once again reiterated that VR support for Xbox was not a focus for the company, following repo… [+1254 chars]"
35,"{'id': 'the-verge', 'name': 'The Verge'}",Zoe Schiffer,"Amazon threatened warehouse workers organizing amid COVID-19 pandemic, says US labor board complaint",Amazon managers at a warehouse in Queens reportedly interrogated one of the lead walkout organizers in violation of US labor law. The case was settled before it went to trial.,https://cdn.vox-cdn.com/thumbor/y-L6MHvt0CtVVEz71kNdDVgrdQ4=/0x146:2040x1214/fit-in/1200x630/cdn.vox-cdn.com/uploads/chorus_asset/file/13443460/acastro_181114_1777_amazon_hq2_0001.jpg,2021-03-22T21:13:25Z,"The investigation found that Amazon managers may have violated US labor law on four accounts
Illustration by Alex Castro / The Verge
The National Labor Relations Board (NLRB) found merit to the cla… [+2596 chars]"
36,"{'id': 'bbc-news', 'name': 'BBC News'}",https://www.facebook.com/bbcnews,Armie Hammer: US actor accused of rape,"The Call Me By Your Name star denies the allegations, saying the relationship was consensual.",https://ichef.bbci.co.uk/news/1024/branded_news/CE1A/production/_117626725_mediaitem117626724.jpg,2021-03-18T23:30:22Z,"image copyrightGetty Images
image captionArmie Hammer's lawyer described the allegations against his client as ""outrageous""
US actor Armie Hammer has been accused of raping a woman in Los Angeles i… [+2970 chars]"
